{
  "id": "processo-seletivo-2026",
  "nome": "Processo Seletivo 2026",
  "ano_ingresso": 2026,
  "instituicao": "IFPR",
  "fontes": [
    "https://ifpr.edu.br/estude-conosco/processos-seletivos-tecnicos/",
    "https://ifpr.edu.br/processo-seletivo/"
  ],
  "editais": [
    {
      "id": "edital-integrados-2026",
      "titulo": "Edital do Processo Seletivo IFPR 2026 - Cursos Técnicos Integrados",
      "ano": 2025,
      "tipo": "técnico integrado",
      "url": "https://ifpr.edu.br/processo-seletivo/processo-seletivo-2026/integrados/editais/"
    },
    {
      "id": "edital-subsequentes-curitiba-assis-2026",
      "titulo": "Edital do Processo Seletivo IFPR 2026 - Cursos Técnicos Subsequentes de Curitiba e Assis Chateaubriand",
      "ano": 2025,
      "tipo": "técnico subsequente",
      "url": "https://ifpr.edu.br/processo-seletivo/processo-seletivo-2026/subsequentes/curitiba-e-assis-chateaubriand/inscricoes/"
    },
    {
      "id": "edital-subsequentes-demais-campi-2026",
      "titulo": "Edital do Processo Seletivo IFPR 2026 - Cursos Técnicos Subsequentes dos demais campi",
      "ano": 2025,
      "tipo": "técnico subsequente",
      "url": "https://ifpr.edu.br/processo-seletivo/processo-seletivo-2026/subsequentes/subsequentes-demais-campi/inscricoes/"
    }
  ],
  "ofertas": [
    {
      "id": "arapongas-tecnico-em-sistemas-de-energias-renovaveis-vespertino",
      "campus_id": "arapongas",
      "curso_nome": "Técnico em Sistemas de Energias Renováveis",
      "tipo_oferta": "técnico integrado",
      "modalidade": "presencial",
      "turno": "Vespertino",
      "vagas": {
        "quantidade": 40,
        "forma_oferta": "40 vagas; 1 turma(s); turno Vespertino; duração 4 anos",
        "trecho_fonte": "Arapongas; Técnico em Sistemas de Energias Renováveis; Turmas: 1; Turno: Vespertino; Vagas: 40; Duração: 4 anos",
        "status_curadoria": "sugerido"
      },
      "fonte": {
        "url": "https://ifpr.edu.br/processo-seletivo/processo-seletivo-2026/integrados/cursos/"
      }
    },
    {
      "id": "assis-chateaubriand-tecnico-em-agropecuaria-diurno-manha-3-tardes-por-semana-1",
      "campus_id": "assis-chateaubriand",
      "curso_nome": "Técnico em Agropecuária",
      "tipo_oferta": "técnico integrado",
      "modalidade": "presencial",
      "turno": "Diurno (Manhã + 3 tardes por semana)¹",
      "vagas": {
        "quantidade": 80,
        "forma_oferta": "80 vagas; 2 turma(s); turno Diurno (Manhã + 3 tardes por semana)¹; duração 3 anos",
        "trecho_fonte": "Assis Chateaubriand; Técnico em Agropecuária; Turmas: 2; Turno: Diurno (Manhã + 3 tardes por semana)¹; Vagas: 80; Duração: 3 anos",
        "status_curadoria": "sugerido"
      },
      "fonte": {
        "url": "https://ifpr.edu.br/processo-seletivo/processo-seletivo-2026/integrados/cursos/"
      },
      "curso_id": "tecnico-em-agropecuaria-integrado-ao-ensino-medio"
    },
    {
      "id": "assis-chateaubriand-tecnico-em-comercio-diurno-manha-2-tardes-por-semana-2",
      "campus_id": "assis-chateaubriand",
      "curso_nome": "Técnico em Comércio",
      "tipo_oferta": "técnico integrado",
      "modalidade": "presencial",
      "turno": "Diurno (Manhã + 2 tardes por semana)²",
      "vagas": {
        "quantidade": 40,
        "forma_oferta": "40 vagas; 1 turma(s); turno Diurno (Manhã + 2 tardes por semana)²; duração 3 anos",
        "trecho_fonte": "Assis Chateaubriand; Técnico em Comércio; Turmas: 1; Turno: Diurno (Manhã + 2 tardes por semana)²; Vagas: 40; Duração: 3 anos",
        "status_curadoria": "sugerido"
      },
      "fonte": {
        "url": "https://ifpr.edu.br/processo-seletivo/processo-seletivo-2026/integrados/cursos/"
      },
      "curso_id": "tecnico-em-comercio"
    },
    {
      "id": "assis-chateaubriand-tecnico-em-informatica-para-internet-diurno-manha-2-tardes-por-semana-1",
      "campus_id": "assis-chateaubriand",
      "curso_nome": "Técnico em Informática para Internet",
      "tipo_oferta": "técnico integrado",
      "modalidade": "presencial",
      "turno": "Diurno (manhã + 2 tardes por semana)¹",
      "vagas": {
        "quantidade": 40,
        "forma_oferta": "40 vagas; 1 turma(s); turno Diurno (manhã + 2 tardes por semana)¹; duração 3 anos",
        "trecho_fonte": "Assis Chateaubriand; Técnico em Informática para Internet; Turmas: 1; Turno: Diurno (manhã + 2 tardes por semana)¹; Vagas: 40; Duração: 3 anos",
        "status_curadoria": "sugerido"
      },
      "fonte": {
        "url": "https://ifpr.edu.br/processo-seletivo/processo-seletivo-2026/integrados/cursos/"
      },
      "curso_id": "tecnico-em-informatica-para-internet-integrado-ao-ensino-medio"
    },
    {
      "id": "assis-chateaubriand-tecnico-em-mecatronica-diurno-manha-2-tardes-por-semana-1",
      "campus_id": "assis-chateaubriand",
      "curso_nome": "Técnico em Mecatrônica",
      "tipo_oferta": "técnico integrado",
      "modalidade": "presencial",
      "turno": "Diurno (manhã + 2 tardes por semana)¹",
      "vagas": {
        "quantidade": 40,
        "forma_oferta": "40 vagas; 1 turma(s); turno Diurno (manhã + 2 tardes por semana)¹; duração 3 anos",
        "trecho_fonte": "Assis Chateaubriand; Técnico em Mecatrônica; Turmas: 1; Turno: Diurno (manhã + 2 tardes por semana)¹; Vagas: 40; Duração: 3 anos",
        "status_curadoria": "sugerido"
      },
      "fonte": {
        "url": "https://ifpr.edu.br/processo-seletivo/processo-seletivo-2026/integrados/cursos/"
      },
      "curso_id": "tecnico-em-mecatronica-integrado-ao-ensino-medio"
    },
    {
      "id": "astorga-tecnico-em-informatica-matutino",
      "campus_id": "astorga",
      "curso_nome": "Técnico em Informática",
      "tipo_oferta": "técnico integrado",
      "modalidade": "presencial",
      "turno": "Matutino",
      "vagas": {
        "quantidade": 40,
        "forma_oferta": "40 vagas; 1 turma(s); turno Matutino; duração 4 anos",
        "trecho_fonte": "Astorga; Técnico em Informática; Turmas: 1; Turno: Matutino; Vagas: 40; Duração: 4 anos",
        "status_curadoria": "sugerido"
      },
      "fonte": {
        "url": "https://ifpr.edu.br/processo-seletivo/processo-seletivo-2026/integrados/cursos/"
      },
      "curso_id": "curso-tecnico-de-informatica-integrado-ao-ensino-medio"
    },
    {
      "id": "barracao-tecnico-em-administracao-matutino",
      "campus_id": "barracao",
      "curso_nome": "Técnico em Administração",
      "tipo_oferta": "técnico integrado",
      "modalidade": "presencial",
      "turno": "Matutino",
      "vagas": {
        "quantidade": 40,
        "forma_oferta": "40 vagas; 1 turma(s); turno Matutino; duração 4 anos",
        "trecho_fonte": "Barracão; Técnico em Administração; Turmas: 1; Turno: Matutino; Vagas: 40; Duração: 4 anos",
        "status_curadoria": "sugerido"
      },
      "fonte": {
        "url": "https://ifpr.edu.br/processo-seletivo/processo-seletivo-2026/integrados/cursos/"
      },
      "curso_id": "tecnico-em-administracao"
    },
    {
      "id": "barracao-tecnico-em-informatica-matutino",
      "campus_id": "barracao",
      "curso_nome": "Técnico em Informática",
      "tipo_oferta": "técnico integrado",
      "modalidade": "presencial",
      "turno": "Matutino",
      "vagas": {
        "quantidade": 40,
        "forma_oferta": "40 vagas; 1 turma(s); turno Matutino; duração 4 anos",
        "trecho_fonte": "Barracão; Técnico em Informática; Turmas: 1; Turno: Matutino; Vagas: 40; Duração: 4 anos",
        "status_curadoria": "sugerido"
      },
      "fonte": {
        "url": "https://ifpr.edu.br/processo-seletivo/processo-seletivo-2026/integrados/cursos/"
      },
      "curso_id": "tecnico-em-informatica"
    },
    {
      "id": "campo-largo-tecnico-em-administracao-matutino",
      "campus_id": "campo-largo",
      "curso_nome": "Técnico em Administração",
      "tipo_oferta": "técnico integrado",
      "modalidade": "presencial",
      "turno": "Matutino",
      "vagas": {
        "quantidade": 40,
        "forma_oferta": "40 vagas; 1 turma(s); turno Matutino; duração 4 anos",
        "trecho_fonte": "Campo Largo; Técnico em Administração; Turmas: 1; Turno: Matutino; Vagas: 40; Duração: 4 anos",
        "status_curadoria": "sugerido"
      },
      "fonte": {
        "url": "https://ifpr.edu.br/processo-seletivo/processo-seletivo-2026/integrados/cursos/"
      },
      "curso_id": "administracao"
    },
    {
      "id": "campo-largo-tecnico-em-agroecologia-vespertino",
      "campus_id": "campo-largo",
      "curso_nome": "Técnico em Agroecologia",
      "tipo_oferta": "técnico integrado",
      "modalidade": "presencial",
      "turno": "Vespertino",
      "vagas": {
        "quantidade": 40,
        "forma_oferta": "40 vagas; 1 turma(s); turno Vespertino; duração 4 anos",
        "trecho_fonte": "Campo Largo; Técnico em Agroecologia; Turmas: 1; Turno: Vespertino; Vagas: 40; Duração: 4 anos",
        "status_curadoria": "sugerido"
      },
      "fonte": {
        "url": "https://ifpr.edu.br/processo-seletivo/processo-seletivo-2026/integrados/cursos/"
      },
      "curso_id": "agroecologia"
    },
    {
      "id": "campo-largo-tecnico-em-automacao-industrial-vespertino",
      "campus_id": "campo-largo",
      "curso_nome": "Técnico em Automação Industrial",
      "tipo_oferta": "técnico integrado",
      "modalidade": "presencial",
      "turno": "Vespertino",
      "vagas": {
        "quantidade": 40,
        "forma_oferta": "40 vagas; 1 turma(s); turno Vespertino; duração 4 anos",
        "trecho_fonte": "Campo Largo; Técnico em Automação Industrial; Turmas: 1; Turno: Vespertino; Vagas: 40; Duração: 4 anos",
        "status_curadoria": "sugerido"
      },
      "fonte": {
        "url": "https://ifpr.edu.br/processo-seletivo/processo-seletivo-2026/integrados/cursos/"
      },
      "curso_id": "automacao-industrial"
    },
    {
      "id": "campo-largo-tecnico-em-mecanica-matutino",
      "campus_id": "campo-largo",